{
  "analyzed_at": "2026-04-21T21:16:05+08:00",
  "version": "1.0",
  "input_files": [
    "knowledge\\raw\\github-search-2026-04-21-211417.json",
    "knowledge\\raw\\github-trending-2026-04-21-211259.json"
  ],
  "items": [
    {
      "title": "openclaw",
      "url": "https://github.com/openclaw/openclaw",
      "source": "github-search",
      "popularity": 361630,
      "popularity_type": "total_stars",
      "author": "openclaw",
      "created_at": "2025-11-24T18:16:47+08:00",
      "updated_at": "2026-04-21T21:10:39+08:00",
      "language": "TypeScript",
      "topics": [
        "ai",
        "assistant",
        "crustacean",
        "molty",
        "openclaw",
        "own-your-data",
        "personal"
      ],
      "description": "Your own personal AI assistant. Any OS. Any Platform. The lobster way. 🦞 ",
      "readme": "# 🦞 OpenClaw — Personal AI Assistant\n\n<p align=\"center\">\n    <picture>\n        <source media=\"(prefers-color-scheme: light)\" srcset=\"https://raw.githubusercontent.com/openclaw/openclaw/main/docs/assets/openclaw-logo-text-dark.svg\">\n        <img src=\"https://raw.githubusercontent.com/openclaw/openclaw/main/docs/assets/openclaw-logo-text.svg\" alt=\"OpenClaw\" width=\"500\">\n    </picture>\n</p>\n\n<p align=\"center\">\n  <strong>EXFOLIATE! EXFOLIATE!</strong>\n</p>\n\n<p align=\"center\">\n  <a href=\"https://github.com/openclaw/openclaw/actions/workflows/ci.yml?branch=main\"><img src=\"https://img.shields.io/github/actions/workflow/status/openclaw/openclaw/ci.yml?branch=main&style=for-the-badge\" alt=\"CI status\"></a>\n  <a href=\"https://github.com/openclaw/openclaw/releases\"><img src=\"https://img.shields.io/github/v/release/openclaw/openclaw?include_prereleases&style=for-the-badge\" alt=\"GitHub release\"></a>\n  <a href=\"https://discord.gg/clawd\"><img src=\"https://img.shields.io/discord/1456350064065904867?label=Discord&logo=discord&logoColor=white&color=5865F2&style=for-the-badge\" alt=\"Discord\"></a>\n  <a href=\"LICENSE\"><img src=\"https://img.shields.io/badge/License-MIT-blue.svg?style=for-the-badge\" alt=\"MIT License\"></a>\n</p>\n\n**OpenClaw** is a _personal AI assistant_ you run on your own devices.\nIt answers you on the channels you already use. It can speak and listen on macOS/iOS/Android, and can render a live Canvas you control. The Gateway is just the control plane — the product is the assistant.\n\nIf you want a personal, single-user assistant that feels local, fast, and always-on, this is it.\n\nSupported channels include: WhatsApp, Telegram, Slack, Discord, Google Chat, Signal, iMessage, BlueBubbles, IRC, Microsoft Teams, Matrix, Feishu, LINE, Mattermost, Nextcloud Talk, Nostr, Synology Chat, Tlon, Twitch, Zalo, Zalo Personal, WeChat, QQ, WebChat.\n\n[Website](https://openclaw.ai) · [Docs](https://docs.openclaw.ai) · [Vision](VISION.md) · [DeepWiki](https://deepwiki.com/openclaw/openclaw) · [Getting Started](https://docs.openclaw.ai/start/getting-started) · [Updating](https://docs.openclaw.ai/install/updating) · [Showcase](https://docs.openclaw.ai/start/showcase) · [FAQ](https://docs.openclaw.ai/help/faq) · [Onboarding](https://docs.openclaw.ai/start/wizard) · [Nix](https://github.com/openclaw/nix-openclaw) · [Docker](https://docs.openclaw.ai/install/docker) · [Discord](https://discord.gg/clawd)\n\nNew install? Start here: [Getting started](https://docs.openclaw.ai/start/getting-started)\n\nPreferred setup: run `openclaw onboard` in your terminal.\nOpenClaw Onboard guides you step by step through setting up the gateway, workspace, channels, and skills. It is the recommended CLI setup path and works on **macOS, Linux, and Windows (via WSL2; strongly recommended)**.\nWorks with npm, pnpm, or bun.\n\n## Sponsors\n\n<table>\n  <tr>\n    <td align=\"center\" width=\"16.66%\">\n      <a href=\"https://openai.com/\">\n        <picture>\n          <source media=\"(prefers-color-scheme: light)\" srcset=\"https://raw.githubusercontent.com/openclaw/openclaw/main/docs/assets/sponsors/openai-light.svg\">\n          <img src=\"https://raw.githubusercontent.com/openclaw/openclaw/main/docs/assets/sponsors/openai.svg\" alt=\"OpenAI\" height=\"28\">\n        </picture>\n      </a>\n    </td>\n    <td align=\"center\" width=\"16.66%\">\n      <a href=\"https://github.com/\">\n        <picture>\n          <source media=\"(prefers-color-scheme: light)\" srcset=\"https://raw.githubusercontent.com/openclaw/openclaw/main/docs/assets/sponsors/github-light.svg\">\n          <img src=\"https://raw.githubusercontent.com/openclaw/openclaw/main/docs/assets/sponsors/github.svg\" alt=\"GitHub\" height=\"28\">\n        </picture>\n      </a>\n    </td>\n    <td align=\"center\" width=\"16.66%\">\n      <a href=\"https://www.nvidia.com/\">\n        <picture>\n          <source media=\"(prefers-color-scheme: light)\" srcset=\"https://raw.githubusercontent.com/openclaw/openclaw/main/docs/assets/sponsors/nvidia.svg\">\n          <img src=\"https://raw.githubusercontent.com/openclaw/openclaw/main/docs/assets/sponsors/nvidia-dark.svg\" alt=\"NVIDIA\" height=\"28\">\n        </picture>\n      </a>\n    </td>\n    <td align=\"center\" width=\"16.66%\">\n      <a href=\"https://vercel.com/\">\n        <picture>\n          <source media=\"(prefers-color-scheme: light)\" srcset=\"https://raw.githubusercontent.com/openclaw/openclaw/main/docs/assets/sponsors/vercel-light.svg\">\n          <img src=\"https://raw.githubusercontent.com/openclaw/openclaw/main/docs/assets/sponsors/vercel.svg\" alt=\"Vercel\" height=\"24\">\n        </picture>\n      </a>\n    </td>\n    <td align=\"center\" width=\"16.66%\">\n      <a href=\"https://blacksmith.sh/\">\n        <picture>\n          <source media=\"(prefers-color-scheme: light)\" srcset=\"https://raw.githubusercontent.com/openclaw/openclaw/main/docs/assets/sponsors/blacksmith-light.svg\">\n          <img src=\"https://raw.githubusercontent.com/openclaw/openclaw/main/docs/assets/sponsors/blacksmith.svg\" alt=\"Blacksmith\" height=\"28\">\n        </picture>\n    ",
      "summary": "OpenClaw是一款开源的个人AI助手，采用TypeScript编写，强调数据自主权（own-your-data），用户可在本地设备上部署运行。项目支持跨操作系统（macOS、Linux、Windows via WSL2）和平台，通过网关（Gateway）作为控制平面，集成多种通信渠道如WhatsApp、Telegram、Slack、Discord、iMessage等，实现语音交互与实时Canvas渲染。它提供CLI引导安装（openclaw onboard），支持Docker和Nix部署，旨在构建快速、常驻、单用户的本地化AI助手体验。",
      "analysis": {
        "summary": "OpenClaw是一款开源的个人AI助手，采用TypeScript编写，强调数据自主权（own-your-data），用户可在本地设备上部署运行。项目支持跨操作系统（macOS、Linux、Windows via WSL2）和平台，通过网关（Gateway）作为控制平面，集成多种通信渠道如WhatsApp、Telegram、Slack、Discord、iMessage等，实现语音交互与实时Canvas渲染。它提供CLI引导安装（openclaw onboard），支持Docker和Nix部署，旨在构建快速、常驻、单用户的本地化AI助手体验。",
        "highlights": [
          "强调数据自主权，用户完全掌控个人数据，避免云端依赖",
          "跨平台支持，兼容主流操作系统及超过20种通信渠道，扩展性强",
          "提供完整的本地化部署方案，包括Docker、Nix和CLI工具，安装与维护便捷"
        ],
        "relevance_score": 7,
        "tags": [
          "ai-assistant",
          "personal-ai",
          "local-deployment"
        ],
        "category": "框架",
        "maturity": "生产"
      }
    },
    {
      "title": "n8n",
      "url": "https://github.com/n8n-io/n8n",
      "source": "github-search",
      "popularity": 184967,
      "popularity_type": "total_stars",
      "author": "n8n-io",
      "created_at": "2019-06-22T17:24:21+08:00",
      "updated_at": "2026-04-21T20:51:11+08:00",
      "language": "TypeScript",
      "topics": [
        "ai",
        "apis",
        "automation",
        "cli",
        "data-flow",
        "development",
        "integration-framework",
        "integrations",
        "ipaas",
        "low-code",
        "low-code-platform",
        "mcp",
        "mcp-client",
        "mcp-server",
        "n8n",
        "no-code",
        "self-hosted",
        "typescript",
        "workflow",
        "workflow-automation"
      ],
      "description": "Fair-code workflow automation platform with native AI capabilities. Combine visual building with custom code, self-host or cloud, 400+ integrations.",